{
  "schemaVersion": "1.0.0",
  "deploymentId": "ensv2-sepolia-2026-07-30",
  "chain": "eip155:11155111",
  "name": {
    "input": "Alice.eth",
    "normalized": "alice.eth",
    "labelhash": "0x0000000000000000000000000000000000000000000000000000000000000022"
  },
  "owner": "0x00000000000000000000000000000000000000a1",
  "durationSeconds": 31536000,
  "resolverConfigHash": "0x0000000000000000000000000000000000000000000000000000000000000033",
  "payment": "direct",
  "custodyMode": "direct",
  "identity": "none",
  "identityConfigHash": "0x0000000000000000000000000000000000000000000000000000000000000000",
  "maxSpend": {
    "asset": "0x00000000000000000000000000000000000000c0",
    "maxTotalAmount": "5000000",
    "maxRegistrationAmount": "5000000"
  },
  "nonce": "1",
  "expiry": 1787700000,
  "rolesConfigHash": "0x0000000000000000000000000000000000000000000000000000000000000000"
}
