{
  "schemaVersion": "1.0.0",
  "deploymentId": "ensv2-sepolia-2026-07-30",
  "chain": "eip155:11155111",
  "name": {
    "input": "Alice.eth",
    "normalized": "alice.eth",
    "labelhash": "0x0000000000000000000000000000000000000000000000000000000000000022"
  },
  "owner": "0x00000000000000000000000000000000000000a1",
  "durationSeconds": 31536000,
  "resolverConfigHash": "0x0000000000000000000000000000000000000000000000000000000000000033",
  "payment": "x402",
  "custodyMode": "provider-custody-transfer-last",
  "identity": "erc8004",
  "identityConfigHash": "0x0000000000000000000000000000000000000000000000000000000000000044",
  "maxSpend": {
    "asset": "0x00000000000000000000000000000000000000c0",
    "maxTotalAmount": "5000000",
    "maxRegistrationAmount": "5000000"
  },
  "nonce": "4",
  "expiry": 1787700000,
  "provider": {
    "providerId": "0x0000000000000000000000000000000000000000000000000000000000000055",
    "url": "https://registrar.example.invalid",
    "quoteId": "q-123"
  },
  "idempotencyKey": "0x0000000000000000000000000000000000000000000000000000000000000011",
  "rolesConfigHash": "0x0000000000000000000000000000000000000000000000000000000000000000",
  "identityConfig": {
    "adapterProxy": "0x00000000000000000000000000000000000000ad",
    "adapterImplementation": "0x000000000000000000000000000000000000001b",
    "bindingStandard": "erc1155",
    "anchorKind": "token-id"
  }
}
